IR-M-U-0108,Jamia Millia IslamiaMore Details,New Delhi,Delhi,51.41,34,65.78,27.65,75.45,73.76,9.23,Management
IR-M-U-0467,National Institute of Technology TiruchirappalliMore Details,Tiruchirappalli,Tamil Nadu,50.49,35,47.47,40.13,75.43,66.73,24.51,Management
IR-M-U-0500,Banaras Hindu UniversityMore Details,Varanasi,Uttar Pradesh,49.51,36,65.41,20.94,77.96,59.88,20.34,Management
IR-M-S-394,Institute of Management TechnologyMore Details,Ghaziabad,Uttar Pradesh,48.27,37,65.0,19.31,78.25,62.15,11.1,Management
IR-M-U-0735,BML Munjal UniversityMore Details,Gurgaon,Haryana,48.27,37,69.74,19.34,75.13,64.43,0.79,Management
IR-M-U-0213,Alliance UniversityMore Details,Bengaluru,Karnataka,47.47,39,70.01,9.44,81.67,65.23,7.93,Management
IR-M-S-15962,Indian Institute of ManagementMore Details,Nagpur,Maharashtra,47.38,40,66.35,3.15,86.44,63.33,29.1,Management
IR-M-U-0497,Amity University NoidaMore Details,Gautam Budh Nagar,Uttar Pradesh,47.35,41,65.72,32.47,51.86,64.14,11.1,Management
IR-M-U-0078,Panjab UniversityMore Details,Chandigarh,Chandigarh,47.22,42,64.89,19.59,74.96,60.93,7.93,Management
IR-M-I-1066,FORE School of ManagementMore Details,New Delhi,Delhi,47.11,43,62.21,12.93,85.09,62.0,13.46,Management
IR-M-U-0146,Nirma UniversityMore Details,Ahmedabad,Gujarat,46.75,44,74.6,9.04,72.37,63.32,8.59,Management
IR-M-U-0496,Aligarh Muslim UniversityMore Details,Aligarh,Uttar Pradesh,46.71,45,61.42,28.82,69.89,47.94,8.59,Management
IR-M-C-37013,PSG College of TechnologyMore Details,Coimbatore,Tamil Nadu,46.69,46,61.69,17.06,74.98,51.94,28.71,Management
IR-M-S-354,Birla Institute of Management TechnologyMore Details,Greater Noida,Uttar Pradesh,46.65,47,65.03,9.69,81.75,70.85,7.93,Management
IR-M-S-87,Goa Institute of ManagementMore Details,Sanquelim,Goa,46.63,48,66.07,12.54,74.21,68.63,13.46,Management
IR-M-U-0379,Lovely Professional UniversityMore Details,Phagwara,Punjab,46.58,49,71.79,21.32,57.99,70.53,0.0,Management
IR-M-S-331,Loyola Institute of Business AdministrationMore Details,Chennai,Tamil Nadu,46.51,50,63.56,6.59,85.92,56.1,26.66,Management
IR-M-U-0747,Chandigarh UniversityMore Details,Mohali,Punjab,46.4,51,71.79,5.85,73.89,81.64,1.56,Management
IR-M-I-1408,International Management InstituteMore Details,Kolkata,West Bengal,46.22,52,69.83,9.6,75.77,63.17,9.23,Management
IR-M-I-1238,Institute for Financial Management and ResearchMore Details,"Sri City, Chittoor",Andhra Pradesh,46.16,53,63.66,7.36,84.69,73.93,5.22,Management
IR-M-I-1480,Thapar Institute of Engineering & TechnologyMore Details,Patiala,Punjab,46.14,54,62.21,35.18,53.86,58.48,3.06,Management
IR-M-U-0490,Vellore Institute of TechnologyMore Details,Vellore,Tamil Nadu,45.89,55,60.46,42.81,42.5,46.78,17.31,Management
IR-M-S-220,K. J. Somaiya Institute of Management Studies & ResearchMore Details,Mumbai,Maharashtra,45.5,56,68.65,4.55,84.19,60.3,6.6,Management
IR-M-U-0099,Guru Gobind Singh Indraprastha UniversityMore Details,New Delhi,Delhi,45.22,57,63.78,17.77,74.51,51.3,7.27,Management
IR-M-U-0202,Birla Institute of TechnologyMore Details,Ranchi,Jharkhand,45.13,58,61.28,22.12,56.88,58.95,28.31,Management
IR-M-U-0439,Anna UniversityMore Details,Chennai,Tamil Nadu,44.81,59,51.32,36.21,47.94,51.29,38.29,Management
IR-M-I-1048,Institute of Management TechnologyMore Details,Nagpur,Maharashtra,44.71,60,69.97,4.53,79.51,61.49,3.06,Management
IR-M-I-1132,Institute of Management TechnologyMore Details,Hyderabad,Telangana,44.38,61,66.22,6.65,72.17,70.31,10.48,Management
IR-M-I-1058,Indian Institute of Forest ManagementMore Details,Bhopal,Madhya Pradesh,44.26,62,70.7,6.76,70.23,63.05,6.6,Management
IR-M-I-1124,International Management InstituteMore Details,Bhubaneswar,Odisha,44.02,63,68.25,8.24,69.69,62.18,9.23,Management
IR-M-I-1156,Bharati Vidyapeeth?s Institute of Management and Entrepreneurship DevelopmentMore Details,Pune,Maharashtra,44.02,63,67.27,0.43,73.06,74.17,16.78,Management
IR-M-U-0851,IIHMR UNIVERSITYMore Details,Jaipur,Rajasthan,43.97,65,64.74,8.19,73.14,72.25,2.32,Management
IR-M-U-0564,University of Petroleum and Energy StudiesMore Details,Dehradun,Uttarakhand,43.73,66,70.42,17.99,53.68,62.32,2.32,Management
IR-M-C-32855,Jagan Institute of Management StudiesMore Details,Delhi,Delhi,43.45,67,64.57,4.71,79.07,67.76,0.79,Management
IR-M-C-34129,Principal L N Welingkar Institute of Management Development and Research More Details,Mumbai,Maharashtra,43.4,68,68.54,4.45,77.35,56.63,3.79,Management
IR-M-S-3283,Jaipuria Institute of ManagementMore Details,Noida,Uttar Pradesh,43.38,69,63.55,6.81,77.91,63.85,3.06,Management
IR-M-U-0020,Koneru Lakshmaiah Education Foundation UniversityMore Details,Vaddeswaram,Andhra Pradesh,43.3,70,74.06,6.77,58.93,68.82,3.79,Management
IR-M-U-0249,Visvesvaraya Technological UniversityMore Details,Belgaum,Karnataka,43.24,71,70.14,10.34,65.77,54.97,4.51,Management
IR-M-S-92,Institute of Rural Management AnandMore Details,Anand,Gujarat,42.7,72,54.41,10.55,81.69,53.54,15.15,Management
IR-M-S-419,Jaipuria Institute of ManagementMore Details,Lucknow,Uttar Pradesh,42.56,73,66.2,2.53,79.3,58.47,2.32,Management
IR-M-U-0147,Pandit Deendayal Petroleum UniversityMore Details,Gandhinagar,Gujarat,42.47,74,59.21,17.5,75.31,41.7,2.32,Management
IR-M-U-0373,Chitkara UniversityMore Details,Rajpura,Punjab,42.31,75,61.69,6.61,73.95,70.31,0.0,Management
IR-D-N-15,All India Institute of Medical SciencesMore Details,New Delhi,Delhi,90.69,1,92.69,96.57,83.25,72.56,100.0,Medical
IR-D-U-0079,Post Graduate Institute of Medical Education and ResearchMore Details,Chandigarh,Chandigarh,80.06,2,81.14,82.46,86.16,66.08,71.44,Medical
IR-D-C-45654,Christian Medical CollegeMore Details,Vellore,Tamil Nadu,73.56,3,82.96,46.37,97.02,64.2,89.35,Medical
IR-D-U-0236,National Institute of Mental Health & Neuro SciencesMore Details,Bangalore,Karnataka,71.35,4,87.05,59.18,78.39,58.07,59.8,Medical
IR-D-N-33,Sanjay Gandhi Postgraduate Institute of Medical SciencesMore Details,Lucknow,Uttar Pradesh,70.21,5,83.18,58.05,90.81,51.24,45.59,Medical
IR-D-U-0500,Banaras Hindu UniversityMore Details,Varanasi,Uttar Pradesh,64.72,6,72.09,52.73,89.09,57.44,37.07,Medical
IR-D-U-0436,Amrita Institute of Medical Sciences & ResearchMore Details,Kochi,Kerala,64.39,7,75.74,44.82,84.59,70.59,42.39,Medical
IR-D-U-0368,Jawaharlal Institute of Post Graduate Medical Education & ResearchMore Details,Puducherry,Pondicherry,63.17,8,75.64,38.35,71.93,69.55,76.32,Medical
IR-D-C-7242,Kasturba Medical CollegeMore Details,Manipal,Karnataka,62.84,9,67.41,39.78,84.42,72.01,66.14,Medical
IR-D-U-0523,King George`s Medical UniversityMore Details,Lucknow,Uttar Pradesh,62.2,10,74.03,44.22,90.23,43.53,43.21,Medical
IR-D-U-0106,Institute of Liver and Biliary SciencesMore Details,New Delhi,Delhi,61.58,11,88.82,34.6,77.57,58.31,32.06,Medical
IR-D-C-49008,Madras Medical College and Government General HospitalMore Details,Chennai,Tamil Nadu,58.84,12,72.68,17.49,98.06,55.61,66.14,Medical
IR-D-I-1486,Sri Ramachandra Institute of Higher Education And ResearchMore Details,Chennai,Tamil Nadu,57.9,13,72.29,27.29,83.3,66.91,46.73,Medical
IR-D-C-40453,St. John's Medical CollegeMore Details,Bengaluru,Karnataka,57.83,14,72.22,29.16,84.98,65.68,38.47,Medical
IR-D-U-0496,Aligarh Muslim UniversityMore Details,Aligarh,Uttar Pradesh,56.22,15,66.9,37.56,87.0,56.48,18.3,Medical
IR-D-C-32922,Vardhman Mahavir Medical College & Safdarjung HospitalMore Details,New Delhi,Delhi,56.12,16,74.25,25.25,89.28,59.03,25.12,Medical
IR-D-C-6414,Maulana Azad Medical CollegeMore Details,Delhi,Delhi,55.31,17,69.43,26.43,80.4,55.08,49.62,Medical
IR-D-C-29209,Christian Medical CollegeMore Details,Ludhiana,Punjab,55.01,18,74.87,20.34,85.79,65.89,26.97,Medical
IR-D-I-1409,University College of Medical SciencesMore Details,Delhi,Delhi,55.0,19,65.59,37.94,74.63,61.41,28.73,Medical
IR-D-C-35009,JSS Medical CollegeMore Details,Mysore,Karnataka,54.32,20,67.75,18.25,85.8,68.37,45.2,Medical
IR-D-C-7251,Kasturba Medical CollegeMore Details,Mangaluru,Karnataka,53.83,21,66.91,21.12,82.32,69.77,39.81,Medical
IR-D-U-0107,Jamia HamdardMore Details,New Delhi,Delhi,52.87,22,65.91,41.49,60.0,68.94,17.55,Medical
IR-D-U-0363,Siksha `O` AnusandhanMore Details,Bhubaneswar,Odisha,52.72,23,71.83,18.65,83.4,63.2,25.75,Medical
IR-D-I-1110,Dr. D. Y. Patil VidyapeethMore Details,Pune,Maharashtra,52.05,24,71.73,20.49,78.6,69.79,16.8,Medical
IR-D-C-29442,Govt. Medical College & HospitalMore Details,Chandigarh,Chandigarh,52.01,25,69.66,19.06,84.0,58.92,26.97,Medical
IR-D-C-29255,Dayanand Medical CollegeMore Details,Ludhiana,Punjab,51.74,26,77.05,15.27,87.32,53.0,12.77,Medical
IR-D-N-17,Sawai Man Singh Medical CollegeMore Details,Jaipur,Rajasthan,50.44,27,74.89,12.31,88.67,49.49,16.02,Medical
IR-D-C-45515,PSG Institute of Medical Sciences & ResearchMore Details,Coimbatore,Tamil Nadu,50.44,27,72.58,8.0,79.75,62.86,40.25,Medical
IR-D-U-0295,Datta Meghe Institute of Medical SciencesMore Details,Wardha,Maharashtra,50.21,29,70.47,15.11,82.59,68.35,11.91,Medical
IR-D-C-40345,M. S. Ramaiah Medical CollegeMore Details,Bengaluru,Karnataka,50.02,30,75.28,10.16,74.57,60.71,34.14,Medical
IR-D-U-0473,S. R. M. Institute of Science and TechnologyMore Details,Chennai,Tamil Nadu,49.06,31,68.9,28.13,61.8,59.9,16.02,Medical
IR-D-U-0356,Kalinga Institute of Industrial TechnologyMore Details,Bhubaneswar,Odisha,48.18,32,67.66,15.8,68.1,65.88,29.31,Medical
IR-D-U-0168,Maharishi MarkandeshwarMore Details,Ambala,Haryana,48.13,33,68.99,16.49,69.8,61.98,23.19,Medical
IR-D-I-1441,Saveetha Institute of Medical and Technical SciencesMore Details,Chennai,Tamil Nadu,46.49,34,69.69,20.51,58.0,66.4,11.91,Medical
IR-D-U-0443,Annamalai UniversityMore Details,Annamalainagar,Tamil Nadu,46.47,35,59.48,23.66,73.12,46.6,22.53,Medical
IR-D-C-19319,K. S. Hegde Medical AcademyMore Details,Mangaluru,Karnataka,46.31,36,69.62,7.71,67.45,69.19,26.97,Medical
IR-D-C-23033,Krishna Institute of Medical SciencesMore Details,Karad,Maharashtra,46.0,37,70.04,13.65,68.86,63.93,7.35,Medical
IR-D-U-0036,Sri Venkateswara Institute of Medical SciencesMore Details,Tirupati,Andhra Pradesh,45.93,38,69.83,6.74,78.12,52.19,21.17,Medical
IR-D-C-9435,Regional Institute of Medical SciencesMore Details,Imphal West,Manipur,45.93,38,66.34,7.88,76.22,59.17,25.12,Medical
IR-D-C-47762,Mahatma Gandhi Medical College and Research InstituteMore Details,Puducherry,Pondicherry,45.62,40,67.64,10.5,67.26,74.49,12.77,Medical
IR-O-U-0456,Indian Institute of Technology MadrasMore Details,Chennai,Tamil Nadu,85.31,1,81.86,90.67,88.26,62.78,96.16,Overall
IR-O-U-0220,Indian Institute of ScienceMore Details,Bengaluru,Karnataka,84.18,2,82.22,92.16,82.89,52.84,100.0,Overall
IR-O-I-1074,Indian Institute of Technology DelhiMore Details,New Delhi,Delhi,81.33,3,80.59,87.16,77.18,66.41,89.17,Overall
IR-O-U-0306,Indian Institute of Technology BombayMore Details,Mumbai,Maharashtra,80.75,4,79.32,86.46,82.48,54.14,90.97,Overall
IR-O-U-0573,Indian Institute of Technology KharagpurMore Details,Kharagpur,West Bengal,75.85,5,68.6,79.73,86.12,59.07,82.21,Overall
IR-O-I-1075,Indian Institute of Technology KanpurMore Details,Kanpur,Uttar Pradesh,74.99,6,75.64,74.76,81.87,55.61,79.43,Overall
IR-O-U-0053,Indian Institute of Technology GuwahatiMore Details,Guwahati,Assam,68.81,7,74.06,63.55,81.85,62.35,49.09,Overall
IR-O-U-0109,Jawaharlal Nehru UniversityMore Details,New Delhi,Delhi,68.76,8,74.98,44.8,100.0,75.1,53.19,Overall
IR-O-U-0560,Indian Institute of Technology RoorkeeMore Details,Roorkee,Uttarakhand,68.48,9,68.29,67.0,85.21,64.29,44.17,Overall
IR-O-U-0500,Banaras Hindu UniversityMore Details,Varanasi,Uttar Pradesh,62.03,10,70.91,44.89,85.65,58.76,42.84,Overall
IR-O-U-0570,Calcutta UniversityMore Details,Kolkata,West Bengal,61.01,11,59.26,48.58,91.03,61.66,42.84,Overall
IR-O-U-0575,Jadavpur UniversityMore Details,Kolkata,West Bengal,60.77,12,53.38,52.96,90.39,48.67,59.2,Overall
IR-O-U-0436,Amrita Vishwa VidyapeethamMore Details,Coimbatore,Tamil Nadu,60.74,13,69.65,52.11,73.66,65.83,29.04,Overall
IR-O-U-0234,Manipal Academy of Higher EducationMore Details,Manipal,Karnataka,59.96,14,75.44,42.62,75.36,66.21,28.5,Overall
IR-O-U-0042,University of HyderabadMore Details,Hyderabad,Telangana,59.92,15,71.15,42.93,81.18,54.01,40.46,Overall
IR-O-U-0108,Jamia Millia IslamiaMore Details,New Delhi,Delhi,59.85,16,71.35,38.3,88.52,73.05,19.43,Overall
IR-O-U-0013,Indian Institute of Technology HyderabadMore Details,Hyderabad,Telangana,59.59,17,69.97,48.99,66.96,58.36,46.7,Overall
IR-O-U-0120,University of DelhiMore Details,Delhi,Delhi,58.97,18,50.18,55.4,85.21,60.37,42.06,Overall
IR-O-U-0323,Savitribai Phule Pune UniversityMore Details,Pune,Maharashtra,58.77,19,67.66,45.48,85.36,56.22,21.41,Overall
IR-O-U-0439,Anna UniversityMore Details,Chennai,Tamil Nadu,58.1,20,56.0,48.61,77.49,52.37,59.85,Overall
IR-O-U-0447,Bharathiar UniversityMore Details,Coimbatore,Tamil Nadu,57.32,21,67.47,46.47,75.58,52.82,27.4,Overall
IR-O-U-0205,Indian Institute of Technology (Indian School of Mines)More Details,Dhanbad,Jharkhand,56.05,22,52.15,55.69,76.38,56.13,27.95,Overall
IR-O-U-0273,Indian Institute of Technology IndoreMore Details,Indore,Madhya Pradesh,55.94,23,69.47,47.56,69.7,58.93,10.0,Overall
IR-O-U-0467,National Institute of Technology TiruchirappalliMore Details,Tiruchirappalli,Tamil Nadu,55.92,24,60.37,40.88,71.62,64.09,48.08,Overall
IR-O-U-0305,Indian Institute of Science Education & Research PuneMore Details,Pune,Maharashtra,55.43,25,69.95,45.05,59.67,60.47,29.58,Overall
IR-O-U-0701,Indian Institute of Technology (BHU) VaranasiMore Details,Varanasi,Uttar Pradesh,54.82,26,63.03,42.97,67.68,57.09,37.73,Overall
IR-O-U-0391,Birla Institute of Technology & ScienceMore Details,Pilani,Rajasthan,54.13,27,62.76,40.72,72.48,60.97,24.81,Overall
IR-O-U-0490,Vellore Institute of TechnologyMore Details,Vellore,Tamil Nadu,53.89,28,48.71,54.82,67.26,58.15,35.72,Overall
IR-O-U-0572,Indian Institute of Science Education & Research KolkataMore Details,Mohanpur,West Bengal,53.49,29,68.86,38.92,64.94,54.55,27.12,Overall
IR-O-U-0304,Homi Bhabha National InstituteMore Details,Mumbai,Maharashtra,53.2,30,82.4,30.44,69.83,48.72,5.06,Overall
IR-O-U-0496,Aligarh Muslim UniversityMore Details,Aligarh,Uttar Pradesh,52.54,31,70.97,40.78,55.7,57.39,21.41,Overall
IR-O-U-0357,National Institute of Technology RourkelaMore Details,Rourkela,Odisha,51.87,32,56.48,48.96,67.16,48.68,19.43,Overall
IR-O-U-0237,National Institute of Technology KarnatakaMore Details,Surathkal,Karnataka,51.86,33,57.45,37.5,72.93,56.28,31.64,Overall
IR-O-U-0308,Institute of Chemical TechnologyMore Details,Mumbai,Maharashtra,51.7,34,51.99,48.02,75.33,46.08,20.1,Overall
IR-O-U-0139,Indian Institute of Technology GandhinagarMore Details,Gandhinagar,Gujarat,51.49,35,68.47,36.5,55.42,61.46,27.68,Overall
IR-O-U-0006,Andhra UniversityMore Details,Visakhapatnam,Andhra Pradesh,51.24,36,63.77,25.99,86.1,56.86,14.03,Overall
IR-O-U-0107,Jamia HamdardMore Details,New Delhi,Delhi,51.02,37,69.79,28.48,73.16,61.71,7.38,Overall
IR-O-U-0363,Siksha `O` AnusandhanMore Details,Bhubaneswar,Odisha,50.97,38,72.43,25.73,71.13,63.78,9.15,Overall
IR-O-U-0378,Indian Institute of Technology RoparMore Details,Rupnagar,Punjab,50.92,39,69.21,31.54,63.27,60.45,20.1,Overall
IR-O-U-0272,Indian Institute of Science Education & Research BhopalMore Details,Bhopal,Madhya Pradesh,50.83,40,68.07,30.91,65.25,70.48,10.42,Overall
IR-O-I-1357,University of MadrasMore Details,Chennai,Tamil Nadu,50.76,41,65.37,33.16,68.21,55.23,20.43,Overall
IR-O-U-0260,Kerala UniversityMore Details,Thiruvananthapuram,Kerala,50.71,42,73.76,19.03,86.0,51.56,5.06,Overall
IR-O-U-0584,Indian Institute of Engineering Science and TechnologyMore Details,Shibpur,West Bengal,50.41,43,58.92,38.96,65.97,46.0,32.64,Overall
IR-O-U-0078,Panjab UniversityMore Details,Chandigarh,Chandigarh,50.24,44,50.08,42.83,71.27,54.9,26.27,Overall
IR-O-U-0356,Kalinga Institute of Industrial TechnologyMore Details,Bhubaneswar,Odisha,50.24,44,67.82,22.59,72.25,76.16,10.42,Overall
IR-O-U-0025,National Institute of Technology WarangalMore Details,Warangal,Telangana,49.82,46,61.97,30.19,68.87,59.82,24.21,Overall
IR-O-U-0235,Mysore UniversityMore Details,Mysuru,Karnataka,49.75,47,62.99,19.55,92.51,54.45,10.42,Overall
IR-O-U-0476,Shanmugha Arts Science Technology & Research AcademyMore Details,Thanjavur,Tamil Nadu,49.4,48,63.86,35.91,65.46,57.76,6.0,Overall
IR-O-U-0262,Mahatma Gandhi UniversityMore Details,Kottayam,Kerala,49.29,49,69.15,30.32,71.21,46.6,5.53,Overall
IR-O-U-0523,King George`s Medical UniversityMore Details,Lucknow,Uttar Pradesh,48.91,50,77.94,26.47,61.22,44.84,8.71,Overall
IR-O-I-1486,Sri Ramachandra Institute of Higher Education And ResearchMore Details,Chennai,Tamil Nadu,48.59,51,76.71,16.92,67.48,60.92,9.15,Overall
IR-O-I-1480,Thapar Institute of Engineering & TechnologyMore Details,Patiala,Punjab,48.59,51,56.99,38.79,65.75,55.71,11.25,Overall
IR-O-U-0027,Osmania UniversityMore Details,Hyderabad,Telangana,48.54,53,55.95,25.56,86.42,55.22,12.86,Overall
IR-O-U-0064,Indian Institute of Technology PatnaMore Details,Patna,Bihar,48.09,54,67.89,32.37,54.56,52.85,18.06,Overall
IR-O-U-0222,JSS Academy of Higher Education and ResearchMore Details,Mysuru,Karnataka,48.09,54,70.68,18.74,66.64,69.78,9.58,Overall
IR-O-U-0355,Indian Institute of Technology BhubaneswarMore Details,Bhubaneswar,Odisha,47.96,56,56.97,36.3,59.25,55.31,25.98,Overall
IR-O-U-0331,Tata Institute of Social SciencesMore Details,Mumbai,Maharashtra,47.45,57,64.38,11.4,80.01,75.54,11.66,Overall
IR-O-U-0473,S. R. M. Institute of Science and TechnologyMore Details,Chennai,Tamil Nadu,47.27,58,56.48,34.43,67.43,58.58,6.47,Overall
IR-O-U-0377,Indian Institute of Science Education & Research MohaliMore Details,Mohali,Punjab,47.19,59,68.47,29.98,43.61,72.82,16.64,Overall
IR-O-U-0136,Gujarat UniversityMore Details,Ahmedabad,Gujarat,47.1,60,68.05,13.4,83.9,55.67,3.11,Overall
IR-O-U-0474,Sathyabama Institute of Science and TechnologyMore Details,Chennai,Tamil Nadu,47.03,61,60.75,30.41,65.23,64.31,2.1,Overall
IR-O-U-0098,Delhi Technological UniversityMore Details,New Delhi,Delhi,46.89,62,57.71,28.86,66.91,54.62,20.76,Overall
IR-O-U-0497,Amity University NoidaMore Details,Gautam Budh Nagar,Uttar Pradesh,46.88,63,50.79,37.48,66.42,62.52,8.71,Overall
IR-O-U-0435,Alagappa UniversityMore Details,Karaikudi,Tamil Nadu,46.85,64,63.66,22.69,68.36,51.63,21.09,Overall
IR-O-U-0056,Tezpur UniversityMore Details,Tezpur,Assam,46.83,65,62.03,30.34,63.23,49.21,15.54,Overall
IR-O-I-1441,Saveetha Institute of Medical and Technical SciencesMore Details,Chennai,Tamil Nadu,46.81,66,65.8,24.29,64.87,66.51,1.58,Overall
IR-O-U-0184,Indian Institute of Technology MandiMore Details,Mandi,Himachal Pradesh,46.56,67,57.22,30.81,64.14,63.26,10.0,Overall
IR-O-U-0037,Sri Venkateswara UniversityMore Details,Tirupati,Andhra Pradesh,46.14,68,61.83,21.53,76.24,48.81,10.0,Overall
IR-O-U-0589,Visva BharatiMore Details,Santiniketan,West Bengal,45.95,69,58.41,27.29,75.58,40.84,10.42,Overall
IR-O-U-0020,Koneru Lakshmaiah Education Foundation UniversityMore Details,Vaddeswaram,Andhra Pradesh,45.89,70,65.54,24.52,64.0,55.66,5.06,Overall
IR-O-U-0410,Malaviya National Institute of TechnologyMore Details,Jaipur,Rajasthan,45.65,71,61.26,33.25,57.0,55.34,3.61,Overall
IR-O-U-0052,Gauhati UniversityMore Details,Guwahati,Assam,45.48,72,59.87,17.04,81.09,55.87,6.0,Overall
IR-O-U-0329,Symbiosis InternationalMore Details,Pune,Maharashtra,45.43,73,70.05,14.11,63.35,72.57,2.61,Overall
IR-O-U-0341,North Eastern Hill UniversityMore Details,Shillong,Meghalaya,45.31,74,65.03,15.19,75.6,53.4,7.83,Overall
IR-O-I-1110,Dr. D. Y. Patil VidyapeethMore Details,Pune,Maharashtra,45.08,75,75.2,9.71,63.68,63.64,5.06,Overall
IR-O-U-0251,Calicut UniversityMore Details,Malappuram,Kerala,44.71,76,66.18,17.39,69.3,53.19,4.58,Overall
IR-O-U-0448,Bharathidasan UniversityMore Details,Tiruchirappalli,Tamil Nadu,44.7,77,63.49,28.38,50.92,46.57,22.99,Overall
IR-O-U-0196,University of KashmirMore Details,Srinagar,Jammu and Kashmir,44.67,78,60.25,18.51,79.14,49.47,2.61,Overall
IR-O-U-0389,Banasthali VidyapithMore Details,Banasthali,Rajasthan,44.61,79,52.72,12.82,85.27,75.87,3.11,Overall
IR-O-U-0254,Indian Institute of Science Education & Research ThiruvananthapuramMore Details,Thiruvananthapuram,Kerala,44.53,80,61.09,26.45,59.94,47.85,14.79,Overall
IR-O-U-0369,Pondicherry UniversityMore Details,Puducherry,Pondicherry,44.48,81,45.97,28.85,73.14,58.52,15.54,Overall
IR-O-U-0642,Shiv Nadar UniversityMore Details,Dadri,Uttar Pradesh,44.47,82,68.11,16.4,62.82,60.52,5.06,Overall
IR-O-C-16604,Sri Sivasubramaniya Nadar College of EngineeringMore Details,Kancheepuram,Tamil Nadu,44.42,83,58.51,27.12,63.11,53.78,7.38,Overall
IR-O-U-0463,Madurai Kamaraj UniversityMore Details,Madurai,Tamil Nadu,44.27,84,63.88,26.14,56.9,42.62,16.28,Overall
IR-O-U-0202,Birla Institute of TechnologyMore Details,Ranchi,Jharkhand,44.17,85,56.25,28.71,56.04,52.33,22.37,Overall
IR-O-C-37013,PSG College of TechnologyMore Details,Coimbatore,Tamil Nadu,44.17,85,62.42,16.13,60.65,49.93,34.79,Overall
IR-O-U-0446,Bharath Institute of Higher Education & ResearchMore Details,Chennai,Tamil Nadu,44.03,87,59.45,18.56,66.96,66.89,5.53,Overall
IR-O-U-0376,Guru Nanak Dev UniversityMore Details,Amritsar,Punjab,43.81,88,44.31,30.06,77.12,53.04,7.83,Overall
IR-O-U-0253,Cochin University of Science and TechnologyMore Details,Cochin,Kerala,43.71,89,50.14,27.78,67.84,51.36,16.28,Overall
IR-O-U-0195,University of JammuMore Details,Jammu,Jammu and Kashmir,43.61,90,64.78,16.33,72.53,45.63,2.1,Overall
IR-O-N-17,Sawai Man Singh Medical CollegeMore Details,Jaipur,Rajasthan,43.5,91,82.87,4.93,61.02,49.59,0.0,Overall
IR-O-N-10,SVKM`s Narsee Monjee Institute of Management Studies More Details,Mumbai,Maharashtra,43.07,92,66.87,12.44,64.13,62.44,2.1,Overall
IR-O-U-0530,Motilal Nehru National Institute of TechnologyMore Details,Allahabad,Uttar Pradesh,42.87,93,51.75,26.38,66.33,52.1,9.58,Overall
IR-O-U-0055,National Institute of Technology SilcharMore Details,Silchar,Assam,42.76,94,52.19,28.42,64.18,52.18,5.06,Overall
IR-O-U-0318,Mumbai UniversityMore Details,Mumbai,Maharashtra,42.45,95,48.08,20.84,77.97,53.61,8.27,Overall
IR-O-U-0577,National Institute of Technology DurgapurMore Details,Durgapur,West Bengal,42.26,96,47.46,31.21,63.17,51.24,9.15,Overall
IR-O-U-0295,Datta Meghe Institute of Medical SciencesMore Details,Wardha,Maharashtra,42.24,97,73.22,7.13,60.79,59.68,0.0,Overall
IR-O-I-1361,Bharati VidyapeethMore Details,Pune,Maharashtra,42.23,98,61.13,12.09,65.73,58.16,12.86,Overall
IR-O-U-0379,Lovely Professional UniversityMore Details,Phagwara,Punjab,41.81,99,57.28,16.44,62.61,67.68,4.1,Overall
IR-O-U-0345,Mizoram UniversityMore Details,Aizawl,Mizoram,41.8,100,66.0,10.83,67.02,49.9,3.61,Overall
IR-O-U-0215,Bangalore University More Details,Bengaluru,Karnataka,41.8,100,65.5,13.0,57.99,57.2,9.15,Overall
IR-P-U-0107,Jamia HamdardMore Details,New Delhi,Delhi,80.5,1,78.18,85.18,80.85,57.65,95.7,Pharmacy
IR-P-U-0078,Panjab UniversityMore Details,Chandigarh,Chandigarh,79.8,2,76.05,83.43,76.47,71.53,95.05,Pharmacy
IR-P-U-0380,National Institute of Pharmaceutical Education and Research MohaliMore Details,Mohali,Punjab,74.73,3,79.78,61.99,79.53,62.88,100.0,Pharmacy
IR-P-U-0308,Institute of Chemical TechnologyMore Details,Mumbai,Maharashtra,74.5,4,79.12,65.11,86.13,53.79,86.32,Pharmacy
IR-P-I-1077,National Institute of Pharmaceutical Education and Research HyderabadMore Details,Hyderabad,Telangana,73.81,5,81.75,57.7,87.19,65.18,80.23,Pharmacy
IR-P-U-0391,Birla Institute of Technology & ScienceMore Details,Pilani,Rajasthan,72.95,6,88.39,60.82,74.71,67.95,64.47,Pharmacy
IR-P-C-7249,Manipal College of Pharmaceutical SciencesMore Details,Udupi,Karnataka,67.42,7,77.24,44.74,73.25,68.83,93.03,Pharmacy
IR-P-N-14,National Institute of Pharmaceutical Education and Research AhmedabadMore Details,Gandhinagar,Gujarat,65.64,8,84.97,39.56,76.69,66.33,63.08,Pharmacy
IR-P-C-35006,JSS College of PharmacyMore Details,Ooty,Tamil Nadu,65.6,9,77.54,28.53,90.2,73.65,83.81,Pharmacy
IR-P-C-35007,JSS College of PharmacyMore Details,Mysore,Karnataka,64.58,10,76.16,28.41,82.33,68.59,98.82,Pharmacy
IR-P-I-1073,National Institute of Pharmaceutical Education and Research GuwahatiMore Details,Guwahati,Assam,60.45,11,84.16,30.8,70.57,66.68,51.78,Pharmacy
IR-P-U-0443,Annamalai UniversityMore Details,Annamalainagar,Tamil Nadu,59.88,12,72.88,52.84,67.02,37.78,49.89,Pharmacy
IR-P-N-10,SVKM`s Narsee Monjee Institute of Management Studies More Details,Mumbai,Maharashtra,57.85,13,77.13,34.25,81.91,60.45,20.0,Pharmacy
IR-P-U-0143,Maharaja Sayajirao University of BarodaMore Details,Vadodara,Gujarat,57.68,14,66.72,42.86,77.34,52.01,41.3,Pharmacy
IR-P-U-0436,Amrita School of PharmacyMore Details,Kochi,Kerala,56.82,15,58.11,53.78,66.3,63.83,36.24,Pharmacy
IR-P-U-0202,Birla Institute of TechnologyMore Details,Ranchi,Jharkhand,56.52,16,66.3,42.3,59.38,60.42,60.15,Pharmacy
IR-P-U-0146,Nirma UniversityMore Details,Ahmedabad,Gujarat,55.05,17,62.01,41.58,69.74,52.36,47.9,Pharmacy
IR-P-N-26,National Institute of Pharmaceutical Education and Research RaebareliMore Details,LUCKNOW,Uttar Pradesh,54.99,18,83.31,30.27,53.0,59.59,43.62,Pharmacy
IR-P-U-0473,S. R. M. Institute of Science and TechnologyMore Details,Chennai,Tamil Nadu,54.85,19,59.2,57.11,51.76,50.28,45.82,Pharmacy
IR-P-U-0389,Banasthali VidyapithMore Details,Banasthali,Rajasthan,54.54,20,70.47,26.18,82.42,74.82,15.83,Pharmacy
IR-P-U-0497,Amity University NoidaMore Details,Gautam Budh Nagar,Uttar Pradesh,54.49,21,67.88,53.39,44.28,59.01,33.46,Pharmacy
IR-P-C-35430,"Poona College of Pharmacy, PuneMore Details",Pune,Maharashtra,54.44,22,64.87,28.05,72.51,54.85,65.82,Pharmacy
IR-P-U-0383,Punjabi UniversityMore Details,Patiala,Punjab,54.29,23,60.1,47.0,68.05,39.71,45.82,Pharmacy
